<?xml version="1.0" encoding="UTF-8"?>
<!DOCTYPE instructions SYSTEM "../dtd/plantInstruction.dtd">
<?xml-stylesheet type="text/xsl" href="instructional displaying style.xsl"?>
          
<instructions>
    <!-- adding metadata here -->
    <meta>
        <source>https://www.ufseeds.com/</source>
        <reference>Urban Farmer. (n.d.). From Seed to Harvest: A beginner’s guide to growing Aster. https://files.ufseeds.com/uploads/Instructions-for-Growing-Aster.pdf/></reference>
        <reference>Urban Farmer. (n.d.). From Seed to Harvest: A beginner’s guide to growing Cosmos. https://files.ufseeds.com/uploads/Instructions-for-Growing-Cosmos.pdf</reference>
        <reference>Urban Farmer. (n.d.). From Seed to Harvest: A beginner’s guide to growing Daisies. https://files.ufseeds.com/uploads/Instructions-for-Growing-Daisies.pdf"/></reference>
        <reference>Urban Farmer. (n.d.). From Seed to Harvest: A beginner’s guide to growing Echinacea. https://files.ufseeds.com/uploads/Instructions-for-Growing-Echinacea.pdf</reference>
        <reference>Urban Farmer. (n.d.). From Seed to Harvest: A beginner’s guide to growing Marigolds. https://files.ufseeds.com/uploads/Instructions-for-Growing-Marigolds.pdf</reference>
        <reference>Urban Farmer. (n.d.). From Seed to Harvest: A beginner’s guide to growing Phlox. https://files.ufseeds.com/uploads/Instructions-for-Growing-Phlox.pdf</reference>
        <reference>Urban Farmer. (n.d.). From Seed to Harvest: A beginner’s guide to growing Poppies. https://files.ufseeds.com/uploads/Instructions-for-Growing-Poppies.pdf</reference>
        <reference>Urban Farmer. (n.d.). From Seed to Harvest: A beginner’s guide to growing Rudbeckia. https://files.ufseeds.com/uploads/Instructions-for-Growing-Rudbeckia.pdf</reference>
        <reference>Urban Farmer. (n.d.). From Seed to Harvest: A beginner’s guide to growing Salvia. https://files.ufseeds.com/uploads/Instructions-for-Growing-Salvia.pdf</reference>
        <reference>Urban Farmer. (n.d.). From Seed to Harvest: A beginner’s guide to growing Zinnias. https://files.ufseeds.com/uploads/Instructions-for-Growing-Zinnias.pdf</reference>
        <author>Yibei Chen</author>
        <accessingDate>Thursday 05 March 2020</accessingDate>
    </meta>


    <!-- The first instruction starts from here  -->
    <instruction type="Aster">
        
        <!-- the information in page header is less relevant to the scenarios I intend to create
            therefore, detailed mark-ups are not provided. -->
        <pageHeader>
            URBAN FARMER LOVE THE EARTH
            120 E 161st Street, Westfield, Indiana 46074
            Phone: 317-600-2807 • Email: customerservice@ufseeds.com
            website: ufseeds.com
        </pageHeader>
        
        
        
        <!-- Section 1: Title -->
        <!-- The title are divided into two parts: the first level tells the scope, 
            from Seed to Harvest and the difficulty level of the tutorial. The second part declares 
            the name of the flower type of the instruction: Aster and pictures -->
        <articleTitle>
            <instructionDescription>From Seed to Harvest:
                A beginner’s guide to growing </instructionDescription>
            <flowerName>Aster</flowerName>
            <photo filename="../img/Aster.jpg"/>
            <photoDescription>Alpinus Mix Aster seeds available at </photoDescription><website url='ufseeds.com'>ufseeds.com</website>
            <photo filename="../img/Aster2.jpg"/>
            <photoDescription>Powder Puff Mix Aster seeds available at </photoDescription><website url='ufseeds.com'>ufseeds.com</website>
        </articleTitle>
        
        <!-- Section 2: Introduction -->
        <!-- The introduction covers most of the characteristics of the flower -->    
        <!--these characteristics are labeled so that it can be extracted and then rearranged 
            with characteristics of flowers in other ten chosen materials   -->
        <introduction>
            Aster is a flower that looks similar to daisies because of its <appearance><colors part="center">bright yellow, round center</colors></appearance> that is surrounded by <appearance><colors part="petal">colorful petals</colors></appearance>. Aster is a <lifeCycle>perennial</lifeCycle>, which means it comes back year after year. It grows in many different colors with 
            <appearance><colors part="bloom"> white, blue, pink and purple being the most common</colors></appearance>. 
            Aster flowers can reach up to <appearance><maxHeight>8 feet</maxHeight></appearance>
            tall depending on the variety, and the flowers will attract <insect type="attraction">butterflies</insect> to the garden
        </introduction>
        
        
        <!-- In several instructions, a few planting steps are required only in special circumstances.
               Using attributes to clarify the conditions allow stylesheet to fetch and display applicable  conditions 
               efficiently, so that beginner gardeners could  know the applicability of each step. -->
        <!-- Section 3: Planting -->
        <planting>
            <title>To plant:</title>
            <plantingSteps nmbr="1" condition="general">
                Begin Aster seeds <location type="planting">indoors</location> six weeks before the last frost.
            </plantingSteps>
            
            <plantingSteps nmbr="2" condition="general">
                Plant two seeds 1/8 deep in <materials type="tools">a smallpot</materials> with <materials  type="tools">a sterile potting mix</materials>.
            </plantingSteps>
            
            <plantingSteps nmbr="3" condition="general">
                Make sure the soil is <soil type="planting">thoroughly watered</soil>bafter planting the seeds.
            </plantingSteps>
            
            <plantingSteps nmbr="4" condition="general">
                Cover the pots with <materials type="tools">a plastic bag</materials> to keep the environment  <temperature type="planting">warm</temperature>and <moisture>moist</moisture>, which will encourage germination.
            </plantingSteps>
            
            <plantingSteps nmbr="5" condition="general">
                Seeds should sprout within 10 days. Remove the plastic once the seeds sprout.
            </plantingSteps>    
        </planting>
        
        <!-- Different from the planting steps, instruction of growing stage is relatively more
            condition-oriented. Using attributes to clarify the conditions allow stylesheet to fetch 
            and display applicable  conditions efficiently, so that beginner gardeners could  know
            the applicability of each step. -->
        <!-- Section 4: Growth -->
        <growth>
            <title>To grow:</title>
            <!-- the following growth instruction applies to the general condition of growing Aster  -->
            <growthMethods nmbr="1" condition="general">
                <growthSteps nmbr="1">
                    Once seedlings have their second set of leaves, thin them so only the strongest one remains in each <materials type="tools">pot</materials>. 
                </growthSteps>
                <growthSteps nmbr="2">
                    Once seedlings are 6 inches tall, transplant them <location type="growing">outdoors</location>. 
                </growthSteps>
                <growthSteps nmbr="3">
                    Space them <space type="growing">18 inches apart</space>. Aster grows best in <exposure>full sun</exposure> or <exposure>partial shade</exposure>. 
                </growthSteps>
            </growthMethods>
            
            <!-- the following growth instruction applies to the condition of growing Aster in containers  -->
            <growthMethods nmbr="2" condition="containers-grown">
                <growthSteps nmbr="1">
                    In addition to growing well in <bed type="flower-bed">a flower bed</bed>, Aster also grows well in <bed type="container">containers</bed> as a potted plant. Instead of transplanting seedlings to a flower bed,
                    they can also be transplanted to <materials type="tools">a 12-inch diameter pot</materials> <location type="growing">outside</location>.
                </growthSteps>
                <growthSteps nmbr="2">
                    After transplanting, add <materials type="other">mulch</materials> around the plants to keep the soil <soil type="growing">cool and retain moisture</soil>.
                </growthSteps>
            </growthMethods>
            
            <!-- the following growth instruction applies to the all conditions  -->
            <growthMethods nmbr="3" condition="general">
                <growthSteps nmbr="1">
                    Aster flowers require <watering>1 inch of water per week</watering>. 
                </growthSteps>
            </growthMethods>
            
            <!-- the following growth instruction applies to the condition in which Aster plants have deadheading  -->
            <growthMethods nmbr="4" condition="deadheading">
                <growthSteps nmbr="1">
                    They grow better when trimmed lightly and when their dead flowers are deadheaded. Deadheading is done by pinching off the dead blooms.
                </growthSteps>
            </growthMethods>
            
            <!-- the following growth instruction applies to the condition in growing a taller type of Aster  -->
            <growthMethods nmbr="5" condition="taller variaty">
                <growthSteps nmbr="1">
                    Also, with taller varieties of the plant, cut back any stems that begin to grow leggy. 
                </growthSteps>
                <growthSteps nmbr="2">